{
  "$schema": "../../packages/spec/schema/dsh-skin.schema.json",
  "schemaVersion": 1,
  "id": "dsh.skins.ocean-mint",
  "name": "Ocean Mint",
  "version": "0.1.0",
  "summary": "A calm token-only example that degrades consistently on every client.",
  "author": {
    "id": "dsh-skins",
    "name": "DshSkins contributors"
  },
  "license": {
    "spdx": "MIT",
    "commercialUse": true
  },
  "contentRating": "general",
  "compatibility": {
    "requiredCapabilities": ["tokens.semantic.v1"],
    "optionalCapabilities": []
  },
  "palettes": {
    "light": {
      "color.background.base": "#F3F8F7",
      "color.background.surface": "#FFFFFF",
      "color.background.sidebar": "#E1F0ED",
      "color.text.primary": "#14231F",
      "color.text.secondary": "#536964",
      "color.border": "#B9CDC8",
      "color.accent": "#087F6B",
      "color.accent.contrast": "#FFFFFF",
      "color.state.success": "#14804A",
      "color.state.warning": "#956B00",
      "color.state.error": "#C9372C",
      "radius.control": 10,
      "radius.panel": 18
    },
    "dark": {
      "color.background.base": "#0E1715",
      "color.background.surface": "#172420",
      "color.background.sidebar": "#122C27",
      "color.text.primary": "#EAF5F2",
      "color.text.secondary": "#A8C0BA",
      "color.border": "#315048",
      "color.accent": "#4FD1B5",
      "color.accent.contrast": "#081411",
      "color.state.success": "#58D68D",
      "color.state.warning": "#F2C94C",
      "color.state.error": "#FF7B72",
      "radius.control": 10,
      "radius.panel": 18
    }
  },
  "assets": {},
  "provenance": {
    "aiGenerated": false,
    "rightsStatement": "Original token palette contributed under the declared MIT license."
  }
}
